{
  "body_state": {
    "body_identity_sha256": "ed4b000260e5e5598ea00848b6f664a828a241e1791afa292e12b8db54d1a993",
    "confidence": 1,
    "content_sha256": "c7a7ac08a93afdc2a3fe6eb27a555ecb3d3de833d3e7917a01ff04a483f4b1f9",
    "correctives_enabled": true,
    "joint_rotations_xyzw": [
      [
        0,
        0,
        0,
        1
      ],
      [
        0,
        0,
        0,
        1
      ],
      [
        0,
        0,
        0,
        1
      ],
      [
        0,
        0,
        0,
        1
      ],
      [
        0,
        0,
        0,
        1
      ],
      [
        0,
        0,
        0,
        1
      ],
      [
        0,
        0,
        0,
        1
      ],
      [
        0,
        0,
        0,
        1
      ],
      [
        0,
        0,
        0,
        1
      ],
      [
        0,
        0,
        0,
        1
      ],
      [
        0,
        0,
        0,
        1
      ],
      [
        0,
        0,
        0,
        1
      ],
      [
        0,
        0,
        0,
        1
      ],
      [
        0,
        0,
        0,
        1
      ],
      [
        0,
        0,
        0,
        1
      ],
      [
        0,
        0,
        0,
        1
      ],
      [
        0,
        0,
        0,
        1
      ],
      [
        0,
        0,
        0,
        1
      ],
      [
        0,
        0,
        0,
        1
      ],
      [
        0,
        0,
        0,
        1
      ],
      [
        0,
        0,
        0,
        1
      ],
      [
        0,
        0,
        0,
        1
      ],
      [
        0,
        0,
        0,
        1
      ],
      [
        0,
        0,
        0,
        1
      ],
      [
        0,
        0,
        0,
        1
      ],
      [
        0,
        0,
        0,
        1
      ],
      [
        0,
        0,
        0,
        1
      ],
      [
        0,
        0,
        0,
        1
      ],
      [
        0,
        0,
        0,
        1
      ],
      [
        0,
        0,
        0,
        1
      ],
      [
        0,
        0,
        0,
        1
      ],
      [
        0,
        0,
        0,
        1
      ],
      [
        0,
        0,
        0,
        1
      ],
      [
        0,
        0,
        0,
        1
      ],
      [
        0,
        0,
        0,
        1
      ],
      [
        0,
        0,
        0,
        1
      ],
      [
        0,
        0,
        0,
        1
      ],
      [
        0,
        0,
        0,
        1
      ],
      [
        0,
        0,
        0,
        1
      ],
      [
        0,
        0,
        0,
        1
      ],
      [
        0,
        0,
        0,
        1
      ],
      [
        0,
        0,
        0,
        1
      ],
      [
        0,
        0,
        0,
        1
      ],
      [
        0,
        0,
        0,
        1
      ],
      [
        0,
        0,
        0,
        1
      ],
      [
        0,
        0,
        0,
        1
      ],
      [
        0,
        0,
        0,
        1
      ],
      [
        0,
        0,
        0,
        1
      ],
      [
        0,
        0,
        0,
        1
      ],
      [
        0,
        0,
        0,
        1
      ],
      [
        0,
        0,
        0,
        1
      ],
      [
        0,
        0,
        0,
        1
      ],
      [
        0,
        0,
        0,
        1
      ],
      [
        0,
        0,
        0,
        1
      ],
      [
        0,
        0,
        0,
        1
      ],
      [
        0,
        0,
        0,
        1
      ],
      [
        0,
        0,
        0,
        1
      ],
      [
        0,
        0,
        0,
        1
      ],
      [
        0,
        0,
        0,
        1
      ],
      [
        0,
        0,
        0,
        1
      ],
      [
        0,
        0,
        0,
        1
      ],
      [
        0,
        0,
        0,
        1
      ],
      [
        0,
        0,
        0,
        1
      ],
      [
        0,
        0,
        0,
        1
      ],
      [
        0,
        0,
        0,
        1
      ],
      [
        0,
        0,
        0,
        1
      ],
      [
        0,
        0,
        0,
        1
      ],
      [
        0,
        0,
        0,
        1
      ],
      [
        0,
        0,
        0,
        1
      ],
      [
        0,
        0,
        0,
        1
      ],
      [
        0,
        0,
        0,
        1
      ],
      [
        0,
        0,
        0,
        1
      ],
      [
        0,
        0,
        0,
        1
      ],
      [
        0,
        0,
        0,
        1
      ],
      [
        0,
        0,
        0,
        1
      ],
      [
        0,
        0,
        0,
        1
      ],
      [
        0,
        0,
        0,
        1
      ]
    ],
    "model_spec_sha256": "234a951c4e534b5ec7826907eaf2ee86d1d287f62e26e530b85e1dff5d44bd1d",
    "named_pose": "canonical-t",
    "tracked_source": null,
    "posed_surface_sha256": "caa66dff9b3625771c8f4c35bfe59556d30acdc3800880106f98f0ce75c49a95",
    "provenance": {
      "created_utc": "2026-09-04T01:09:37Z",
      "producer": "tatbot-human-representation-fixture",
      "source_sha256": "7ee9e277ac96eac49d2f9c7ae34ed43404b0103d5fe2196c75a5d2e8fa8c0726",
      "version": "1"
    },
    "schema": "tatbot.body-state/1",
    "tatbot_from_body": [
      [
        1,
        0,
        0,
        0
      ],
      [
        0,
        1,
        0,
        0
      ],
      [
        0,
        0,
        1,
        0
      ],
      [
        0,
        0,
        0,
        1
      ]
    ]
  },
  "calibration": {
    "captured_utc": "2026-09-04T01:09:37Z",
    "sha256": "c94919d7f2ce44ff1d9768c9cde0cc742caccf0147893d8fc1b312e61a09e5ce"
  },
  "content_sha256": "016109a49a75d458c781f04ff44406776b529a52ff9b5610c6b73d1ae4627e36",
  "exact_events": [
    {
      "ink_event_index": 1,
      "kind": "stroke",
      "sample_range": [
        0,
        2
      ]
    }
  ],
  "ink_program": {
    "compiler_sha256": "d22cb7b3c94214261230f0b94b286d4bcfcb0bca3079807af89981b9bfeff912",
    "content_sha256": "e5b402eb0cbd7d1a40ef064d50407c637b5aef4261621ea8118c718ec373943f",
    "events": [
      {
        "kind": "pen_transition",
        "state": "approach"
      },
      {
        "allowed_tool_class": "ballpoint",
        "contact_envelope_m": [
          -0.0002,
          0.0002
        ],
        "curve": {
          "compiler_sha256": "d22cb7b3c94214261230f0b94b286d4bcfcb0bca3079807af89981b9bfeff912",
          "coordinates": [
            {
              "barycentric": [
                0.2,
                0.3,
                0.5
              ],
              "face_index": 1200,
              "topology_sha256": "e0ca7ee25dc0b4c8d841bb2626e364bb88b7af7fae037e30854728842e320a18"
            },
            {
              "barycentric": [
                0.1,
                0.6,
                0.3
              ],
              "face_index": 1201,
              "topology_sha256": "e0ca7ee25dc0b4c8d841bb2626e364bb88b7af7fae037e30854728842e320a18"
            }
          ],
          "deposition": 0.7,
          "direction": "forward",
          "rest_surface_arc_length_m": 0.01,
          "source_primitive_sha256": "08554971c0d5722df1ae0e4a99e6093152da91cb8ea14ee717ffbfe48c36c8f7",
          "width_m": 0.0008
        },
        "kind": "stroke",
        "ordering_rationale": "single connected fixture curve",
        "orientation_tolerance_rad": 0.12,
        "research_depth_band_m": null,
        "speed_m_s": 0.004,
        "start_choice": "start"
      },
      {
        "kind": "pen_transition",
        "state": "retract"
      },
      {
        "dependency": "after-stroke-1",
        "expected_load_after": 0.82,
        "ink_id": "black",
        "kind": "dip",
        "target_load": [
          0.75,
          0.9
        ],
        "trigger_reason": "fixture budget"
      },
    {
      "kind": "tool_change",
      "required_tool_class": "ballpoint",
      "transition_intent": "fixture-only explicit transition"
      },
      {
        "intent": "end of color group",
        "kind": "barrier"
      }
    ],
    "initial_ink_state": {
      "ink_id": "black",
      "load_fraction": 0.8
    },
    "predicted_ink_state": {
      "ink_id": "black",
      "load_fraction": 0.62
    },
    "provenance": {
      "created_utc": "2026-09-04T01:09:37Z",
      "producer": "tatbot-human-representation-fixture",
      "source_sha256": "7ce660fa89bd2b0954f074e6432eb5086231116228daaa1eaecf9fadeae99663",
      "version": "1"
    },
    "schema": "tatbot.ink-program/1",
    "surface_placement_sha256": "90837f9ffacc888d74a9afe3b3a89c02bd4203d54534505da275a8cb46fdb61c",
    "tattoo_program_sha256": "6e46984c4abc85cf6588524699edb588b1701d89bac4bfffc8f9e37e593f4e0b",
    "total_material_path_length_m": 0.01,
    "uncertainty": {
      "length_sigma_m": 1e-05,
      "load_sigma": 0.02
    }
  },
  "measured_surface": {
    "path": "current-surface.npz",
    "schema": "tatbot.surface/1",
    "sha256": "93befe916c6fef5af853976cd7c2c2a8b7ded088b5d530cc0ccdaaf50ab681c9"
  },
  "palette": {
    "load_state_sha256": "988d8da7852bf981bdc63fb7cb3742a1c4d50b1dcf3182f5957882c092e5363d",
    "resolved_caps": [
      {
        "ink_id": "black",
        "robot_base_from_cap": [
          [
            1,
            0,
            0,
            0
          ],
          [
            0,
            1,
            0,
            0
          ],
          [
            0,
            0,
            1,
            0
          ],
          [
            0,
            0,
            0,
            1
          ]
        ],
        "slot": 0
      }
    ],
    "snapshot_sha256": "b66b625d4db814533d1e0557e9604f64faa7a99f603f274f19e9216a1aff76b8"
  },
  "preflight": {
    "max_surface_age_s": 60,
    "observed_cells_only": true,